{
  "$schema": "https://json-schema.org/draft/2020-12/schema",
  "$id": "https://chainbench.io/schema/network.json",
  "title": "Network",
  "type": "object",
  "required": ["name", "chain_type", "chain_id", "nodes"],
  "additionalProperties": false,
  "properties": {
    "name":       { "type": "string", "pattern": "^[a-z0-9][a-z0-9_-]*$" },
    "chain_type": { "type": "string", "enum": ["stablenet", "wbft", "wemix", "ethereum"] },
    "chain_id":   { "type": "integer", "minimum": 1 },
    "nodes": {
      "type": "array",
      "minItems": 1,
      "items": { "$ref": "#/$defs/Node" }
    }
  },
  "$defs": {
    "Node": {
      "type": "object",
      "required": ["id", "provider", "http"],
      "additionalProperties": false,
      "properties": {
        "id":            { "type": "string", "minLength": 1 },
        "role":          { "type": "string", "enum": ["validator", "endpoint", "observer"] },
        "provider":      { "type": "string", "enum": ["local", "remote", "ssh-remote"] },
        "http":          { "type": "string", "format": "uri" },
        "ws":            { "type": "string", "format": "uri" },
        "auth":          { "$ref": "#/$defs/Auth" },
        "provider_meta": { "type": "object" }
      }
    },
    "Auth": {
      "type": "object",
      "required": ["type"],
      "oneOf": [
        {
          "properties": {
            "type":   { "const": "api-key" },
            "header": { "type": "string", "default": "Authorization" },
            "env":    { "type": "string", "description": "env var holding the key" }
          },
          "required": ["type", "env"]
        },
        {
          "properties": {
            "type": { "const": "jwt" },
            "env":  { "type": "string" }
          },
          "required": ["type", "env"]
        },
        {
          "properties": {
            "type": { "const": "ssh-password" },
            "user": { "type": "string" },
            "host": { "type": "string" },
            "port": { "type": "integer", "default": 22 }
          },
          "required": ["type", "user", "host"]
        }
      ]
    }
  }
}
