{
  "name": "my-local",
  "chain_type": "stablenet",
  "chain_id": 8283,
  "nodes": [
    {
      "id": "node1",
      "role": "validator",
      "provider": "local",
      "http": "http://127.0.0.1:8501",
      "ws":   "ws://127.0.0.1:9501",
      "provider_meta": { "pid_key": "node1" }
    }
  ]
}
